{"accountScope":"unverifiable","chatCompletenessPath":"data/completeness/chats.ndjson","crossChecks":{"differences":[],"inventoryCountsMatch":true,"mediaIndexMatchesCas":true,"normalizedRefsResolved":true},"datasetInventoryPath":"data/dataset-inventory.json","evaluatedAtUtc":"2026-01-15T08:00:10.000Z","historyScope":"not_run","localSnapshot":"verified","mediaCounts":{"available":1,"canceled":0,"decryptError":0,"diskSpaceInsufficient":0,"downloadTimeout":0,"expired":0,"full":1,"hashMismatch":0,"missing":0,"noProgressTimeout":0,"notAttempted":0,"requested":1,"thumbnail":0,"tooLarge":0,"transportInterrupted":0,"unavailable":0},"mediaScope":"complete","overall":"partial","reasonCodes":["history_not_requested","optional_datasets_not_requested","account_scope_unverifiable"],"schemaVersion":"1.0.0","sourceId":"22222222-2222-4222-8222-222222222222"}
